<!ELEMENT pedido (tractor+)>

<!ELEMENT tractor (componente+)>

<!ELEMENT componente (fechaentrega?, fragil, peso, numserie, kmmaximos?)>
<!ATTLIST componente fabricante CDATA #REQUIRED>

<!ELEMENT fechaentrega (dia?, mes, anio)>
<!ELEMENT fragil (#PCDATA)>

<!ELEMENT peso (#PCDATA)>
<!ATTLIST peso unidad (kg|g) #REQUIRED>

<!ELEMENT numserie (#PCDATA)>
<!ELEMENT kmmaximos (#PCDATA)>

<!ELEMENT dia (#PCDATA)>
<!ELEMENT mes (#PCDATA)>
<!ELEMENT anio (#PCDATA)>